president_name,speech_title,speech_date,speech_duration
George W. Bush,Address to the Nation on Stem Cell Research,"August 09, 2001",1739
Franklin D. Roosevelt,Quarantine Speech,"October 05, 1937",1852
Franklin Pierce,Veto Message on Legislation Funding Public Works,"August 04, 1854",520
William Harrison,Inaugural Address,"March 04, 1841",8423
Harry S. Truman,Farewell Address,"January 15, 1953",3703
Donald Trump,"Campaign Rally in Tulsa, Oklahoma","June 20, 2020",12646
Thomas Jefferson,Response to Danbury Baptist Association,"January 01, 1802",234
James Buchanan,"Message Regarding the Presence of Troops in Washington, DC","March 01, 1861",580
Herbert Hoover,Statement Regarding Business and Unemployment,"March 07, 1930",399
George W. Bush,Speech on Comprehensive Immigration Reform,"April 09, 2007",3587
John F. Kennedy,Address on the Nuclear Test Ban Treaty,"July 26, 1963",3099
James Monroe,Second Inaugural Address,"March 05, 1821",4461
Lyndon B. Johnson,"Address After Ordering Federal Troops to Detroit, Michigan","July 24, 1967",889
Benjamin Harrison,Message Regarding Valparaiso Incident,"January 25, 1892",6001
Joe Biden,Remarks on the US Response in Support of Israel and Ukraine,"October 20, 2023",2310
Barack Obama,Remarks on the American Recovery and Reinvestment Act,"February 07, 2009",2530
Herbert Hoover,Message Regarding the Farm Bill,"June 11, 1929",365
Andrew Johnson,Message Regarding Control of Abandoned Lands and Property,"June 02, 1865",273
John Quincy Adams,First Annual Message,"December 06, 1825",8966
John F. Kennedy,Address in Miami at the Opening of the AFL-CIO Convention,"December 07, 1961",4147
Zachary Taylor,Message Regarding Treaty with Great Britain,"April 22, 1850",986
Franklin D. Roosevelt,"""Stab in the Back"" Speech","June 10, 1940",1961
Bill Clinton,Remarks to the People of Ghana,"March 23, 1998",1665
John F. Kennedy,Address to the Greater Houston Ministerial Association,"September 12, 1960",1506
James K. Polk,Veto Message Regarding Funding Internal Improvements,"August 03, 1846",2942
Martin Van Buren,First Annual Message to Congress,"December 05, 1837",11435
Gerald Ford,State of the Union Address,"January 15, 1975",4107
Rutherford B. Hayes,Fourth Annual Message,"December 06, 1880",13333
Donald Trump,Remarks after His Acquittal,"February 06, 2020",9804
George Washington,"Message to the House of Representatives, Declining to Submit Diplomatic Instructions and Corresponde","March 30, 1796",1065
